{
  "$schema": "../../../docs/architecture/extension.schema.json",
  "id": "ktheme-preset-church/church",
  "type": "preset",
  "version": "1.0.0",
  "title": "Church Preset",
  "description": "Optional church labels, suggested terms, navigation, and demo guidance.",
  "entry": "ktheme-preset-church.php",
  "dependencies": ["ktheme-engine"],
  "supports": ["editor", "frontend", "responsive", "accessibility"],
  "status": "stable"
}
